{
  "schema_version": 1,
  "id": "neutral.storage.383",
  "version": "1.0.0",
  "profile": "positive-facts-v1",
  "provenance": [
    {
      "id": "neutral-storage-383",
      "uri": "https://github.com/clickbytes/golingua/issues/383",
      "version": "2026-10-26",
      "license": "internal-neutral-example"
    }
  ],
  "symbols": [
    {
      "id": "r",
      "kind": "primitive",
      "review_status": "approved",
      "provenance": [
        {
          "id": "neutral-storage-383",
          "uri": "https://github.com/clickbytes/golingua/issues/383",
          "version": "2026-10-26",
          "license": "internal-neutral-example"
        }
      ],
      "ports": [
        {
          "role": "a",
          "type": {
            "kind": "Entity"
          }
        },
        {
          "role": "b",
          "type": {
            "kind": "Entity"
          }
        }
      ]
    },
    {
      "id": "s",
      "kind": "primitive",
      "review_status": "approved",
      "provenance": [
        {
          "id": "neutral-storage-383",
          "uri": "https://github.com/clickbytes/golingua/issues/383",
          "version": "2026-10-26",
          "license": "internal-neutral-example"
        }
      ],
      "ports": [
        {
          "role": "a",
          "type": {
            "kind": "Entity"
          }
        },
        {
          "role": "b",
          "type": {
            "kind": "Entity"
          }
        }
      ]
    },
    {
      "id": "n",
      "kind": "primitive",
      "review_status": "approved",
      "provenance": [
        {
          "id": "neutral-storage-383",
          "uri": "https://github.com/clickbytes/golingua/issues/383",
          "version": "2026-10-26",
          "license": "internal-neutral-example"
        }
      ],
      "ports": [
        {
          "role": "a",
          "type": {
            "kind": "Entity"
          }
        },
        {
          "role": "b",
          "type": {
            "kind": "Entity"
          }
        },
        {
          "role": "c",
          "type": {
            "kind": "Entity"
          }
        }
      ]
    },
    {
      "id": "c",
      "kind": "primitive",
      "review_status": "approved",
      "provenance": [
        {
          "id": "neutral-storage-383",
          "uri": "https://github.com/clickbytes/golingua/issues/383",
          "version": "2026-10-26",
          "license": "internal-neutral-example"
        }
      ],
      "ports": [
        {
          "role": "a",
          "type": {
            "kind": "Entity"
          }
        }
      ]
    },
    {
      "id": "h",
      "kind": "primitive",
      "review_status": "approved",
      "provenance": [
        {
          "id": "neutral-storage-383",
          "uri": "https://github.com/clickbytes/golingua/issues/383",
          "version": "2026-10-26",
          "license": "internal-neutral-example"
        }
      ],
      "ports": [
        {
          "role": "a",
          "type": {
            "kind": "Event"
          }
        },
        {
          "role": "b",
          "type": {
            "kind": "Entity"
          }
        }
      ]
    },
    {
      "id": "z",
      "kind": "primitive",
      "review_status": "approved",
      "provenance": [
        {
          "id": "neutral-storage-383",
          "uri": "https://github.com/clickbytes/golingua/issues/383",
          "version": "2026-10-26",
          "license": "internal-neutral-example"
        }
      ],
      "ports": []
    },
    {
      "id": "ev",
      "kind": "primitive",
      "review_status": "approved",
      "provenance": [
        {
          "id": "neutral-storage-383",
          "uri": "https://github.com/clickbytes/golingua/issues/383",
          "version": "2026-10-26",
          "license": "internal-neutral-example"
        }
      ],
      "ports": [
        {
          "role": "event",
          "type": {
            "kind": "Event"
          }
        }
      ]
    },
    {
      "id": "r_chain",
      "kind": "alias",
      "review_status": "approved",
      "provenance": [
        {
          "id": "neutral-storage-383",
          "uri": "https://github.com/clickbytes/golingua/issues/383",
          "version": "2026-10-26",
          "license": "internal-neutral-example"
        }
      ],
      "ports": [
        {
          "role": "a",
          "type": {
            "kind": "Entity"
          }
        },
        {
          "role": "b",
          "type": {
            "kind": "Entity"
          }
        }
      ],
      "alias": {
        "interface": [
          {
            "port": "a",
            "binder": "x"
          },
          {
            "port": "b",
            "binder": "y"
          }
        ],
        "expression": {
          "kind": "Lambda",
          "id": "x",
          "type": {
            "kind": "Entity"
          },
          "body": {
            "kind": "Lambda",
            "id": "y",
            "type": {
              "kind": "Entity"
            },
            "body": {
              "kind": "Exists",
              "id": "mid",
              "type": {
                "kind": "Entity"
              },
              "body": {
                "kind": "And",
                "operands": [
                  {
                    "kind": "Atom",
                    "symbol": "r",
                    "args": [
                      {
                        "role": "a",
                        "value": {
                          "kind": "Var",
                          "id": "x"
                        }
                      },
                      {
                        "role": "b",
                        "value": {
                          "kind": "Var",
                          "id": "mid"
                        }
                      }
                    ]
                  },
                  {
                    "kind": "Atom",
                    "symbol": "r",
                    "args": [
                      {
                        "role": "a",
                        "value": {
                          "kind": "Var",
                          "id": "mid"
                        }
                      },
                      {
                        "role": "b",
                        "value": {
                          "kind": "Var",
                          "id": "y"
                        }
                      }
                    ]
                  }
                ]
              }
            }
          }
        }
      }
    }
  ],
  "sorts": [],
  "dependencies": [],
  "typical_edges": [],
  "axioms": []
}
