{
  "schema_version": 1,
  "id": "example.neutral.metadata",
  "version": "1.0.0",
  "profile": "positive-facts-v1",
  "provenance": [
    {
      "id": "neutral-example-380",
      "uri": "https://github.com/clickbytes/golingua/issues/380",
      "version": "2026-10-25",
      "license": "internal-neutral-example"
    }
  ],
  "sorts": [
    {
      "id": "q_entity"
    }
  ],
  "symbols": [
    {
      "id": "link_q",
      "kind": "primitive",
      "review_status": "approved",
      "provenance": [
        {
          "id": "neutral-symbol-link-q",
          "uri": "https://github.com/clickbytes/golingua/issues/380",
          "version": "2026-10-25",
          "license": "internal-neutral-example"
        }
      ],
      "ports": [
        {
          "role": "left",
          "type": {
            "kind": "Nominal",
            "sort_id": "q_entity"
          }
        },
        {
          "role": "right",
          "type": {
            "kind": "Nominal",
            "sort_id": "q_entity"
          }
        }
      ],
      "constraints": [
        {
          "kind": "arity",
          "count": 2
        },
        {
          "kind": "port_type",
          "role": "left",
          "type": {
            "kind": "Nominal",
            "sort_id": "q_entity"
          }
        },
        {
          "kind": "port_type",
          "role": "right",
          "type": {
            "kind": "Nominal",
            "sort_id": "q_entity"
          }
        }
      ]
    },
    {
      "id": "two_hop_q",
      "kind": "alias",
      "review_status": "approved",
      "provenance": [
        {
          "id": "neutral-alias-two-hop",
          "uri": "https://github.com/clickbytes/golingua/issues/380",
          "version": "2026-10-25",
          "license": "internal-neutral-example"
        }
      ],
      "ports": [
        {
          "role": "left",
          "type": {
            "kind": "Nominal",
            "sort_id": "q_entity"
          }
        },
        {
          "role": "right",
          "type": {
            "kind": "Nominal",
            "sort_id": "q_entity"
          }
        }
      ],
      "alias": {
        "interface": [
          {
            "port": "left",
            "binder": "b_start"
          },
          {
            "port": "right",
            "binder": "b_end"
          }
        ],
        "expression": {
          "kind": "Lambda",
          "id": "b_start",
          "type": {
            "kind": "Nominal",
            "sort_id": "q_entity"
          },
          "body": {
            "kind": "Lambda",
            "id": "b_end",
            "type": {
              "kind": "Nominal",
              "sort_id": "q_entity"
            },
            "body": {
              "kind": "Exists",
              "id": "b_middle",
              "type": {
                "kind": "Nominal",
                "sort_id": "q_entity"
              },
              "body": {
                "kind": "And",
                "operands": [
                  {
                    "kind": "Atom",
                    "symbol": "link_q",
                    "args": [
                      {
                        "role": "left",
                        "value": {
                          "kind": "Var",
                          "id": "b_start"
                        }
                      },
                      {
                        "role": "right",
                        "value": {
                          "kind": "Var",
                          "id": "b_middle"
                        }
                      }
                    ]
                  },
                  {
                    "kind": "Atom",
                    "symbol": "link_q",
                    "args": [
                      {
                        "role": "left",
                        "value": {
                          "kind": "Var",
                          "id": "b_middle"
                        }
                      },
                      {
                        "role": "right",
                        "value": {
                          "kind": "Var",
                          "id": "b_end"
                        }
                      }
                    ]
                  }
                ]
              }
            }
          }
        }
      }
    },
    {
      "id": "opaque_note_q",
      "kind": "opaque_unformalized",
      "review_status": "pending",
      "provenance": [
        {
          "id": "neutral-opaque-note",
          "uri": "https://github.com/clickbytes/golingua/issues/380",
          "version": "2026-10-25",
          "license": "internal-neutral-example"
        }
      ]
    }
  ],
  "dependencies": [],
  "typical_edges": [],
  "axioms": []
}
