{
  "schema_version": 1,
  "id": "after-build.44715a4430b7",
  "version": "1.0.0",
  "profile": "positive-facts-v1",
  "provenance": [
    {
      "id": "neutral-example-380",
      "uri": "https://github.com/clickbytes/golingua/issues/380",
      "version": "2026-10-25",
      "license": "internal-neutral-example"
    }
  ],
  "sorts": [
    {
      "id": "sort_44715a4430b7",
      "label": "post-build unrelated domain"
    }
  ],
  "dependencies": [],
  "typical_edges": [],
  "axioms": [],
  "symbols": [
    {
      "id": "relation_44715a4430b7",
      "kind": "primitive",
      "label": "label is not executable",
      "description": "A fresh uninterpreted relation added after the executable was built",
      "review_status": "approved",
      "provenance": [
        {
          "id": "neutral-symbol-link-q",
          "uri": "https://github.com/clickbytes/golingua/issues/380",
          "version": "2026-10-25",
          "license": "internal-neutral-example"
        }
      ],
      "ports": [
        {
          "role": "entry_44715a4430b7",
          "type": {
            "kind": "Nominal",
            "sort_id": "sort_44715a4430b7"
          }
        },
        {
          "role": "entry_44715a4430b7",
          "type": {
            "kind": "Nominal",
            "sort_id": "sort_44715a4430b7"
          }
        }
      ],
      "constraints": [
        {
          "kind": "arity",
          "count": 2
        },
        {
          "kind": "port_type",
          "role": "entry_44715a4430b7",
          "type": {
            "kind": "Nominal",
            "sort_id": "sort_44715a4430b7"
          }
        }
      ]
    }
  ]
}
